tweet,cmi,pp_en,pp_my,perp_ratio,particle_count,manglish_patterns,grammar_patterns,manglish_score,en_words,my_words,unknown_words,category,pp_diff
did you know that klonoa apparently had phone cards for buying minutes for phone calls they do and the art is cool as he,0.0,14232.437118227006,34845.4571780425,2.4483127442324752,0,1,0,0.0625,23,0,1,Monolingual English,20613.0200598155
semakin lama semakin larut saja ya,16.666666666666664,39237.768997503554,6631.524256094602,0.1690086981376674,0,0,0,0.0,1,5,0,Monolingual Malay,-32606.24474140895
aku anak kuat jdi ayo cepet reveal jakeyy,33.333333333333336,41783.733351105795,20156.838132541347,0.4824087393810611,0,0,0,0.0,2,4,2,Mesolect (Strong Mixing),-21626.89521856445
ya faham je been there also lol tapi its really not all that much especially when we put ourselves f,9.999999999999998,23054.18173788485,34936.78356805571,1.5154206714109582,0,0,0,0.0,18,2,0,Weak Code-Mixing,11882.601830170861
namanya juga aldo anak lanang dongo,25.0,45899.15644807737,57225.437600419216,1.2467644730062635,0,0,0,0.0,1,3,2,Mesolect (Strong Mixing),11326.28115234185
all existing things r really consider those beautiful as valuable n rare n those ugly as foul n rottenbut do realiz,0.0,40164.06824556074,48017.35354122345,1.1955301252763586,0,0,0,0.0,18,0,3,Monolingual English,7853.28529566271
sedap ek beach boy langkawi full at,28.57142857142857,41827.8010542195,44178.950596298644,1.0562102114579597,0,0,0,0.0,5,2,0,Mesolect (Strong Mixing),2351.149542079147
oi aldebaran pulang cefat tengoklah jempol bini kau ampe bedarah,12.5,44643.71316687445,38928.80800037306,0.8719885788814306,0,0,0,0.0,1,7,2,Weak Code-Mixing,-5714.90516650139
wheres that tweet that said people deflect responsibility and accountability by using internet activist language,0.0,35170.210369268316,51677.629328745286,1.4693579818305873,0,0,0,0.0,15,0,0,Monolingual English,16507.41895947697
spy x family bakudeku x eri ver,19.999999999999996,45500.683629139814,52078.78972545235,1.1445715881969682,0,0,0,0.0,4,1,2,Weak Code-Mixing,6578.106096312535
nft wl racing game powered by data run or die rules follow,9.090909090909093,44503.19410951422,51034.60565518447,1.1467627588617042,0,0,0,0.0,10,1,1,Weak Code-Mixing,6531.411545670249
hazwan bakri score kejap lg ss tweet ini,37.5,45138.70584286729,18600.06974307675,0.4120647545329634,0,0,0,0.0,3,5,0,Mesolect (Strong Mixing),-26538.63609979054
im sorry yall throw tomatoes at me no bricks tho but id be hurt if im your girl and you dont talk to me all d,0.0,18801.360107325734,41720.87850738607,2.2190351266730968,0,0,0,0.0,25,0,1,Monolingual English,22919.518400060337
played well all agreed including bindu ariyana and hamidabut she behaved very badtoo much of dr,8.333333333333337,36192.96573348564,47394.606216509295,1.3094977229970388,0,0,0,0.0,11,1,4,Weak Code-Mixing,11201.640483023657
bisa pake plastik transparan yg harganya perak mau lebih murah lagi pake kresek bekas k,38.46153846153846,43973.35916860662,36007.209761817496,0.8188414631630803,0,0,0,0.0,5,8,2,Mesolect (Strong Mixing),-7966.149406789125
igs mewsuppasit updated our time ost by mew suppasitlisten to by,11.111111111111116,34932.113515545745,45313.61556538146,1.2971907796307733,0,0,0,0.0,8,1,2,Weak Code-Mixing,10381.502049835712
bayangin kalo jjongdoll masuk literally batu,25.0,45903.62618950355,40934.30486475742,0.891744471248713,0,0,0,0.0,1,3,2,Mesolect (Strong Mixing),-4969.321324746132
big news followed by a huge t forget to participate i,0.0,14119.928804920224,28826.140692711317,2.0415216741508337,0,0,0,0.0,11,0,0,Monolingual English,14706.211887791093
ingatkan hazwan bakri dah pencen mujur ada lagi,25.0,45128.1029022856,9997.92145198387,0.22154535220840194,0,0,0,0.0,2,6,0,Monolingual Malay,-35130.18145030173
kenapa sik sakura channn,33.333333333333336,47320.84783171117,23140.50369196487,0.48901287175285346,0,0,0,0.0,1,2,1,Mesolect (Strong Mixing),-24180.344139746303
i think u understand obsessed,0.0,8541.202384791339,19822.575694266627,2.3208179365428876,0,0,0,0.0,5,0,0,Monolingual English,11281.373309475288
tbt out now on apple music love yall man,0.0,27174.271924215354,40721.55743517537,1.4985335227652539,0,0,0,0.0,8,0,1,Monolingual English,13547.285510960013
the fact that babus r servants of sharif family subordinate to invisible govt fully exposed today that despite pti cm go,15.789473684210531,27109.933003705453,36145.235594238475,1.3332838406239533,0,0,0,0.0,16,3,2,Weak Code-Mixing,9035.302590533021
sharif majid shur al bakra verses to is a description about the glory of that supr,16.666666666666664,18365.205935670423,34512.74255066157,1.8792461501141169,0,0,0,0.0,10,2,4,Weak Code-Mixing,16147.536614991146
da terbukti qm adalah supplier emas kepada bank di malaulysia,37.5,44646.86201365278,37575.131086720554,0.8416074364919592,0,0,0,0.0,3,5,2,Mesolect (Strong Mixing),-7071.730926932229
by first hit to rule hot trending songs chart for weeks congratu,0.0,28156.154689478586,45945.21635201922,1.6318001111560898,0,0,0,0.0,11,0,1,Monolingual English,17789.061662540633
cilaka betul siapa yang edit ni berdekah aku part naik tangga tu,41.666666666666664,44320.14500884323,15248.21885496307,0.344047133688768,0,0,0,0.0,5,7,0,Monolingual Malay,-29071.926153880162
we ready for some cams some pigs who wants to joinfindom femdom paypigs moneyslave feet foot mistresses dom cash,0.0,22713.741797302162,40463.47853966538,1.7814536636350888,0,1,0,0.07894736842105263,15,0,4,Monolingual English,17749.73674236322
bera mu bampane wo,33.333333333333336,47321.51540066551,38012.990209725634,0.8032919040709977,0,0,0,0.0,1,2,1,Mesolect (Strong Mixing),-9308.525190939872
this laundry basket has holes and the cover has holes,0.0,19968.96987894742,28489.429604245735,1.4266849906104138,0,0,0,0.0,9,0,1,Monolingual English,8520.459725298315
sorry but this magic item has done more harm than good,0.0,16223.488264713174,33947.18298777802,2.0924712635083966,0,1,0,0.13636363636363635,11,0,0,Monolingual English,17723.694723064844
antara jempol alias ibu jari kam keganalan atau hp kam berhantu,9.999999999999998,44463.71539214574,28695.602052053007,0.6453712155849648,0,0,0,0.0,1,9,1,Weak Code-Mixing,-15768.113340092736
treasure weverse moment finished assembling the surprise gift from junghwan thank you mak,9.999999999999998,22282.037483681903,32477.03270464284,1.457543221908103,0,0,0,0.0,9,1,3,Weak Code-Mixing,10194.995220960936
gstrm follow rt like this post join telegram,14.28571428571429,31410.11415515829,41110.41405940458,1.3088272731620516,0,0,1,0.125,6,1,1,Basilect (Manglish),9700.29990424629
live pm shri addresses th parkash purab celebrations of sri guru tegh bahadur ji at red fort,16.666666666666664,44219.18145216016,43659.617619844554,0.9873456763798084,0,0,0,0.0,10,2,5,Weak Code-Mixing,-559.563832315609
a dursley man convicted last year of motoring offences out of prison on licence has been arrested by pc greenfi,0.0,23586.527629728247,33099.17606700604,1.4033085576059163,0,0,0,0.0,16,0,4,Monolingual English,9512.648437277792
keningau notis penutupan bekalan elektrik malam,0.0,45899.00227247369,15650.02864927797,0.34096664141790123,0,0,0,0.0,0,5,1,Monolingual Malay,-30248.97362319572
how many people did the poll have in it where were the people in the poll located what is their political party of choic,4.347826086956519,6618.808700203058,27062.913522743904,4.088789198864992,0,0,0,0.0,22,1,1,Monolingual English,20444.104822540845
pertukaran ketiga dilakukan minit sebelum tamat perlawanan dengan memasukkan hazwan bakri buat pertama kali,0.0,44069.71808663454,22306.61655510596,0.5061665361973602,0,0,0,0.0,0,14,0,Ambiguous,-21763.101531528577
k ends in hours retweet like quoted tweet below,0.0,42564.93007531321,35565.21148188731,0.8355519771548833,0,0,0,0.0,9,0,0,Monolingual English,-6999.718593425903
esok balik putrajaya nak jumpa khayra and muee tak shabarnya,42.85714285714286,45066.20948252025,28742.658740859802,0.6377873593297916,0,0,0,0.0,4,3,3,Mesolect (Strong Mixing),-16323.550741660449
pesanku cuman satu dadio wong lanang ojo kere setidaknya punya usaha untuk bertahan hidup lah ora klumbrak klum,14.28571428571429,43741.000906980604,42328.93491301739,0.9677175655635748,0,0,0,0.0,2,12,4,Weak Code-Mixing,-1412.065993963217
bb t h a n k s,0.0,42634.462043914515,26909.79196574717,0.6311746572064035,0,0,0,0.0,7,0,0,Monolingual English,-15724.670078167346
nape malam ni wing aku ceria semua selalu senyap jer,30.000000000000004,44648.86432494096,21819.517417498468,0.48869143140355387,0,0,0,0.0,3,7,0,Mesolect (Strong Mixing),-22829.34690744249
mana satu pilihan hati harini jom beli box terus kotak kotak jimattt delivery area by lalamove,35.71428571428571,43953.46840315929,26988.586318583188,0.6140263169002449,0,0,0,0.0,5,9,2,Mesolect (Strong Mixing),-16964.882084576104
lol so close to getting it but american is deeply could have beautiful streets,0.0,17100.97037965722,42870.008672004646,2.506875792440496,0,0,0,0.0,14,0,0,Monolingual English,25769.038292347424
just made another sale anal pasta stuffing,0.0,21126.895494346903,42225.29139939776,1.99865102805551,0,0,0,0.0,5,0,2,Monolingual English,21098.39590505086
badan bebas first instance body fib hari ini membuat keputusan untuk meluluskan permohonan perak fc untuk lanjutan masa bag,27.77777777777778,43688.66681656249,20033.820239034012,0.4585587452954536,0,0,0,0.0,5,13,1,Mesolect (Strong Mixing),-23654.846577528475
ya allah mingin i sik enom anake yo dipikir no,42.85714285714286,37128.046852971245,16652.12997122069,0.44850541255681675,0,0,0,0.0,4,3,3,Mesolect (Strong Mixing),-20475.916881750556
rocket flava pulak kena kecam banyak ais katanya satu cup adik aku belikan hantar ke rumah pengkalan ais dh hilan,22.22222222222222,43624.68549042553,26679.395765017263,0.6115664895938949,1,0,0,0.1,4,14,2,Mesolect (Strong Mixing),-16945.289725408267
lebih suka jadi dirimu sendiri emot jempol,16.666666666666664,45463.69843963331,25078.778451212223,0.5516220481822838,0,0,0,0.0,1,5,1,Weak Code-Mixing,-20384.919988421083
just a tiny sneak peek however dropping your ens or interacting with this tweet might be beneficial for you,0.0,13036.263279548071,31228.294904466842,2.3954943402730535,0,0,0,0.0,19,0,0,Monolingual English,18192.03162491877
all very well publishing ramping thesis colourful illustrations but where is the deal with a major which w,0.0,8409.924609556496,26064.01696989992,3.09919745776109,0,0,0,0.0,17,0,1,Monolingual English,17654.092360343424
penangkapan dirjen kemendag kasus minyak goreng rocky gerung hanya sebagai sogokan agar tuntutan mahasiswa selesaihtt,0.0,43971.808560167556,52360.107053845626,1.1907653737325856,0,0,0,0.0,0,10,5,Ambiguous,8388.29849367807
we will be at the fantastic witton lakes tomorrow to support the launch of the eco hub amazing work by everyone,5.000000000000004,9551.162698142163,19076.303966050422,1.9972755746021407,0,1,0,0.07142857142857142,19,1,1,Weak Code-Mixing,9525.141267908259
the charged crowd of lahore is increasing by each second kaptaan will reach the venue soon,6.666666666666665,34808.67745909522,35311.42126553932,1.0144430596949536,0,0,0,0.0,14,1,1,Weak Code-Mixing,502.7438064441012
kedah fa salur bantuan wang tunai kepada kumpulan penyokong tetapi sisih bola sepak wanita,0.0,44069.71808663454,15604.723353765788,0.3540917444284353,0,0,0,0.0,0,13,1,Monolingual Malay,-28464.99473286875
kalau takde duit bayar balik cakap kita bukan nak baling cat je i dont want to pay back your ka,35.0,21813.89591475262,11759.568044918024,0.5390860986443551,0,0,0,0.0,13,7,0,Mesolect (Strong Mixing),-10054.327869834595
darul aman bakal gamat sanusi serah sumbangan tunai beli instrumen untuk ultras kedah dan kepda,14.28571428571429,43972.002417787844,38839.09913246092,0.8832688300942482,0,0,0,0.0,2,12,1,Weak Code-Mixing,-5132.903285326924
hellowaiting for sunrisedarkness is not perennial dawn comes after dark night as sp,0.0,29503.157717858692,45762.511075707516,1.5511055295619018,0,0,0,0.0,9,0,4,Monolingual English,16259.353357848824
good night my fav person hari ini capek ya gapapa ya sekarang ayo istirahat tenangin pikiran dan badannya rel,40.0,31518.762241926368,27113.66138628882,0.8602387739142285,0,0,0,0.0,9,6,4,Mesolect (Strong Mixing),-4405.100855637549
emang adanya di bts sistur bukan di scene emg ni moment bedua kudu jeli kudu siap ngejus wortel tiap hari,50.0,43631.75823526205,35376.16786016251,0.8107894178688497,0,0,0,0.0,7,7,6,Mesolect (Strong Mixing),-8255.590375099542
kalau aku ada anak nanti aku taknak bgi dia masuk asrama,36.36363636363637,44464.23812671587,5360.943101281373,0.12056752408539093,0,0,0,0.0,4,7,0,Monolingual Malay,-39103.2950254345
posted the video fucking a stranger from the gym,0.0,21585.473805857564,36110.66305781935,1.6729150067588576,0,0,0,0.0,9,0,0,Monolingual English,14525.189251961787
lempar batu sembunyi tngan apa itu cara org yg berpendikan akhlak yg baik dan lingkungan baik menyelesaikan masala,17.647058823529417,43741.00090952601,23889.22483664841,0.5461517647038059,0,0,0,0.0,3,14,1,Weak Code-Mixing,-19851.7760728776
jangan bilang salah satu di antaranya ada batu punya jeonghan sm dokyeom,19.999999999999996,44312.53752674186,19722.13837397639,0.4450690363212538,0,0,0,0.0,2,8,2,Weak Code-Mixing,-24590.399152765465
jangan gaduh dgn org bodoh jenis letak otak kt pantat mmg mcmtu,0.0,44311.65595777653,17765.39360614561,0.4009191988463219,0,0,0,0.0,0,12,0,Ambiguous,-26546.262351630918
dah ler tu rakyat malaysia bukan tak tahu ni zaman fast info acc pon baru buat pihak,41.17647058823529,43814.14383397689,9467.720529601438,0.21608822405561723,0,0,0,0.0,7,10,0,Monolingual Malay,-34346.42330437545
genevieve witte from rd grade won the best of show in the moline water art contest she will meet the mayor nex,0.0,18997.278803013032,32997.75586471098,1.7369727636716805,0,0,0,0.0,19,0,3,Monolingual English,14000.477061697951
since tan sri not going house early buka puasa second time,27.27272727272727,23696.210614897118,24366.405307320918,1.0282827791884357,0,0,0,0.0,8,3,0,Mesolect (Strong Mixing),670.1946924238
heard you had a thing for androids,0.0,10546.664857247239,47536.82878845992,4.507285424528736,0,0,0,0.0,7,0,0,Monolingual English,36990.16393121268
right now pm pst,0.0,21935.258042009344,43962.88630842033,2.0042110388774432,0,0,0,0.0,3,0,1,Monolingual English,22027.62826641099
we are happy dont worry,0.0,14398.561701540675,9368.344178232419,0.6506444443843296,0,0,0,0.0,5,0,0,Monolingual English,-5030.217523308256
were happy to announce that joined alfprotocol advisory board were thrilled to start working with evan f,0.0,19927.345472654513,42901.66800270309,2.1529043123970175,0,0,0,0.0,15,0,2,Monolingual English,22974.322530048576
halo mahmad farid kakitangan gred rendah sprm gaji awak tu rakyat bayar tau jangan sesuka hati maki orang datang buat,15.000000000000002,43624.09939446065,24701.964076239296,0.566245823274828,0,0,0,0.0,3,17,0,Weak Code-Mixing,-18922.135318221357
i miss the rain,0.0,2703.336847188064,15877.163666091621,5.873172513668286,0,0,0,0.0,4,0,0,Monolingual English,13173.826818903557
one of my fans is enjoying my content you should too religious conversion part ii punishment,12.5,18934.602506702544,32349.25692842359,1.7084729883805312,0,1,0,0.09375,14,2,0,Weak Code-Mixing,13414.654421721047
just posted a photo sepang selangor,33.333333333333336,11093.801019234632,19655.498020631898,1.771755053705474,0,0,0,0.0,4,2,0,Mesolect (Strong Mixing),8561.697001397266
if a temple in any neighbourhood in that neighbourhoid nobody should remain vedic system is that,7.692307692307687,15911.029407600905,33984.06320166533,2.135880861701551,0,0,0,0.0,12,1,3,Monolingual English,18073.033794064428
do u like my socks,0.0,12510.568521056139,32769.43382587701,2.619340101988476,0,0,0,0.0,5,0,0,Monolingual English,20258.86530482087
day q gift you want to gift for jenoa gak tau soalnya aku gak punya jen tapi kalau dikasih kesempatan pengen,44.99999999999999,24113.17369736516,39364.33673904077,1.6324826102564054,0,0,0,0.0,11,9,1,Mesolect (Strong Mixing),15251.163041675612
eugene oregon is a destination spot lol,0.0,15956.947741474116,27238.00119097569,1.7069681265033347,0,0,0,0.0,5,0,2,Monolingual English,11281.053449501575
couldnt resist making my own headcanon,0.0,28400.362056159305,56622.22823914905,1.9937150141671927,0,0,0,0.0,5,0,1,Monolingual English,28221.866182989746
is honored to partner with to get help to from the,0.0,13976.740068260133,20152.526706176075,1.4418617365533308,0,0,0,0.0,11,0,0,Monolingual English,6175.786637915942
here in this youtube video i give my reasons on why i call a superstar do share your thoughts,0.0,19718.364856063657,43105.38968671632,2.1860529512142,0,0,0,0.0,18,0,1,Monolingual English,23387.024830652663
this community has been nothing but peaceful education lover and why do they have to be butchered e,0.0,8350.598345350352,24402.312898519653,2.9222232814139555,0,0,0,0.0,17,0,1,Monolingual English,16051.7145531693
to celebrate k followers we are hosting a giveaway wl spots,9.090909090909093,29607.560797196842,34745.30353632644,1.1735280651561146,0,0,0,0.0,10,1,0,Weak Code-Mixing,5137.7427391296005
called fashion twerp look it up,0.0,20748.855056488177,25925.893279495176,1.2495095854162872,0,0,0,0.0,5,0,1,Monolingual English,5177.038223006999
as it was coachella weekend,0.0,10494.368826343965,18085.070403973677,1.723311873561639,0,0,0,0.0,4,0,1,Monolingual English,7590.701577629712
lepastu ada org komen harga yahudi admin balas balik pun yahudi minum air sirap je la kak gahahahhaha straight to the point,47.61904761904761,26089.532484689847,14901.638222019516,0.5711730645523933,1,0,0,0.09090909090909091,11,10,1,Mesolect (Strong Mixing),-11187.894262670332
aku nunggu gen min,25.0,41198.290137382566,8142.884087790614,0.1976510204825688,0,0,0,0.0,3,1,0,Monolingual Malay,-33055.406049591955
ulahore showing us why they are the heart of pakistan lahore lahore hai,25.0,18668.695238519445,33423.793984695556,1.790365826730711,0,0,0,0.0,9,3,1,Mesolect (Strong Mixing),14755.09874617611
it was inevitable really,0.0,9839.383172373991,14899.182181938777,1.5142394518968596,0,0,0,0.0,4,0,0,Monolingual English,5059.799009564786
me and only fans didnt work before so trying again,0.0,20753.547708041373,31343.891931455193,1.5102907884665127,0,0,0,0.0,10,0,0,Monolingual English,10590.34422341382
taehyung holding onto his next generation,0.0,41785.752378753474,40752.36193259782,0.9752693110132655,0,0,0,0.0,5,0,1,Monolingual English,-1033.3904461556522
maybe this can replace dragon climate is suitable masaaki will research on this pr,0.0,34947.347248433194,37904.67619195077,1.0846224156155417,0,0,0,0.0,13,0,1,Monolingual English,2957.3289435175757
entahla mat penat mau pikir,0.0,46486.079884723156,47614.09380538655,1.02426562797854,0,0,0,0.0,0,5,0,Ambiguous,1128.0139206633903
true indeeds selamatkan malaysia,33.333333333333336,41209.129681694954,6773.899013543269,0.1643785992537529,0,0,0,0.0,2,1,1,Monolingual Malay,-34435.230668151686
upcoming lineups for actor all movies are content oriented and character deman,16.666666666666664,40634.768605861216,55633.61396699888,1.3691135910387393,0,0,0,0.0,10,2,0,Weak Code-Mixing,14998.84536113766
we are officially mindblowon we have wl spot to giveaway tell us why you deserve it and you will get mindblowon tooto jo,5.000000000000004,12980.95100609047,20451.070806285585,1.5754678371939193,0,0,0,0.0,19,1,3,Weak Code-Mixing,7470.119800195114
penyerahan kurniaan duli yang amat mulia tunku mahkota johor untuk keluarga kurang berkemampuan di daerah segamat,18.75,43886.20542565996,16553.87924675253,0.3772000583370918,0,0,0,0.0,3,13,0,Monolingual Malay,-27332.326178907428
raya ni nak makan rumah sape eh kt kl semua pergi kuantan,25.0,44313.338878886265,22560.249622927207,0.5091074198806619,0,0,0,0.0,3,9,0,Mesolect (Strong Mixing),-21753.089255959057
love at first sight,0.0,28989.230047714376,38520.453937169696,1.3287849961440006,0,0,0,0.0,4,0,0,Monolingual English,9531.22388945532
forestieri digantikan dengan hazwan bakri selang minit sebelum tamat masa sebenar perlawanan,0.0,44311.65595777653,38374.85759163617,0.8660217444412959,0,0,0,0.0,0,11,1,Ambiguous,-5936.798366140356
samaa kocak banget udah ada yg bilang kalo peliharaan ada foto batu,33.333333333333336,44311.97654478087,31504.67192880099,0.710974196715485,0,0,0,0.0,4,8,0,Mesolect (Strong Mixing),-12807.304615979876
i hate football tribalism,0.0,10711.438571790995,23898.225713575728,2.2310939425552667,0,0,0,0.0,4,0,0,Monolingual English,13186.787141784733
anecdote mughal prince ali gauhar who later became one of the longest reigning mughal emperor better known as shah alam ii w,25.0,22430.081715224343,30206.737283147526,1.3467065196933636,0,1,0,0.06818181818181818,12,4,6,Mesolect (Strong Mixing),7776.655567923182
kenapa es batu makin lama makin cair kalo makin lama makin cantik kan ayangku,23.076923076923073,44069.994409953346,16261.049369219034,0.3689823333752551,1,0,0,0.14285714285714285,3,10,1,Monolingual Malay,-27808.94504073431
iya seru banget siap kmu juga jangan tidur larut malam ya,27.27272727272727,40577.13393126906,26284.26453901643,0.6477604993871084,0,0,0,0.0,3,8,0,Mesolect (Strong Mixing),-14292.869392252633
naik kereta api lama kat tenom ni really makes me feel what the world,30.76923076923077,17830.021770999218,18735.99594773479,1.0508117257719312,0,0,0,0.0,9,4,1,Mesolect (Strong Mixing),905.9741767355736
nyebut saking terpesona sama park hyung sik ya dear,44.44444444444444,44875.2205133987,46929.95503312415,1.0457877308728087,0,0,0,0.0,5,4,0,Mesolect (Strong Mixing),2054.734519725447
maggie walker started a department store allowing black customers to shop with dignity enter through the main doors i,5.555555555555558,33623.79831889506,39598.81091982187,1.1777018926969094,0,0,0,0.0,17,1,1,Weak Code-Mixing,5975.012600926813
your weapons do not frighten us and you cannot uproot us from our holy land,0.0,20764.94852453293,35136.208113404165,1.6920922328264953,0,0,1,0.06666666666666667,13,0,2,Monolingual English,14371.259588871235
kapre tau dhang k been lo bakri,19.999999999999996,45524.511418357106,42640.34778821909,0.9366459179839761,0,0,0,0.0,4,1,2,Weak Code-Mixing,-2884.163630138013
mesti ramai yang masih kedai makan sedap untuk berbuka puasa bulan ramadan ini kan khas untuk korang semu,22.22222222222222,43741.00090952601,9421.288274553459,0.21538803590801395,1,0,0,0.1111111111111111,4,14,0,Monolingual Malay,-34319.71263497255
rihanna enjoys a sunset dip in barbados april,28.57142857142857,46628.383876498185,40550.871523727874,0.8696606691566353,0,0,0,0.0,5,2,1,Mesolect (Strong Mixing),-6077.512352770311
thanks for iftartapi rugi bawa kite makan buffet sebab mudah kenyang,22.22222222222222,28044.68361792065,36572.18927269675,1.3040685276023936,0,0,0,0.0,2,7,2,Mesolect (Strong Mixing),8527.505654776098
fooohhh jaket hitam baju apa jadah ko datang opis pakai macam tu mat cakap berlagak siak budak,6.25,43809.85302025935,34859.32258635638,0.7956959492705008,0,0,0,0.0,1,15,1,Weak Code-Mixing,-8950.530433902968
lots of destruction due to mongols manchu japanese invasions plus crazy taiping p,19.999999999999996,21660.823886583894,40809.87645425403,1.8840408226360459,0,0,0,0.0,8,2,3,Weak Code-Mixing,19149.052567670136
can i ask for love from everyone baby waanjai here,0.0,16584.559581094967,36159.205069692485,2.180293356171544,0,1,0,0.15,9,0,1,Monolingual English,19574.645488597518
high speed rail network in china vs pan borneo highway sarawak credit fb,46.15384615384615,40410.947169615574,37522.83923371888,0.9285315455791092,0,0,0,0.0,7,6,0,Mesolect (Strong Mixing),-2888.1079358966963
kalau jumpa kat gm klang tegur k yaya macam biasa i yang pakai songkok tu,42.85714285714286,44037.79191343138,13930.429005068974,0.3163289620072945,0,0,0,0.0,6,8,1,Monolingual Malay,-30107.362908362404
income with easy work with feg,0.0,17913.43001744739,40792.22211022686,2.2771865617302716,0,0,0,0.0,5,0,1,Monolingual English,22878.79209277947
malaysians berlagak a lot that they pay a lot of tax let me burst the bubble majority of it comes from the oil of sabah s,7.692307692307687,7322.0743131274185,30425.946056013363,4.155372474363453,0,0,0,0.0,24,2,0,Monolingual English,23103.871742885945
lalaport bukit bintangbaru bukak so maybe they need pekerja baru ig,44.44444444444444,30439.35695420644,49733.125553634316,1.6338428445927355,0,0,0,0.0,5,4,2,Mesolect (Strong Mixing),19293.768599427876
udah tau sakit tp malas berobat takut suatu hal yang tidak diinginkan sama kya kamu,35.71428571428571,43972.260896450796,22254.423305994824,0.5061014114876018,0,0,0,0.0,5,9,1,Mesolect (Strong Mixing),-21717.837590455973
did i do it right,0.0,4933.2167655689,20517.062011734808,4.158962191755378,0,0,0,0.0,5,0,0,Monolingual English,15583.845246165907
serious ku sampe stalk nya pn insta dan ig handsome juak oo bena ka sik nya tok perempuann,41.17647058823529,43743.219842056285,49730.296866631776,1.1368686860773634,0,0,0,0.0,7,10,1,Mesolect (Strong Mixing),5987.07702457549
menteri bumn mencatat pembangunan infrastruktur menjadi kunci bagi pertumbuhan makro ekonomi nasional dan me,25.0,36050.695233475344,25201.6190720849,0.699060556498883,0,0,0,0.0,3,9,2,Mesolect (Strong Mixing),-10849.076161390443
arghhh rasa apa niii,0.0,47320.62530035499,15054.330583233675,0.318134650328062,0,0,0,0.0,0,4,0,Monolingual Malay,-32266.29471712131
kuat banget user sama batu kek dia aku yang as reader aja capek,41.666666666666664,44276.89344725718,26283.127581283094,0.5936082126581818,0,0,0,0.0,7,5,1,Mesolect (Strong Mixing),-17993.765865974085
igt nk buat air pekat modal sikit ke susu byk kena guna igt susu tin murah ke skrg tah apa apa,19.047619047619047,43575.25235886518,22016.69135006052,0.5052567720948913,1,0,0,0.09523809523809523,4,17,0,Weak Code-Mixing,-21558.561008804663
