tweet,cmi,pp_en,pp_my,perp_ratio,particle_count,manglish_patterns,grammar_patterns,manglish_score,en_words,my_words,unknown_words,category,pp_diff
live stream hdkawasaki frontale vs johor darul livemelbourne city fc vs jeonnam dragons livelive,40.0,44087.45407038493,28817.10669839047,0.6536350829509097,0,0,0,0.0,6,4,4,Mesolect (Strong Mixing),-15270.347371994456
god i love them,0.0,12749.356422265428,13802.62713267009,1.082613637545283,0,0,0,0.0,4,0,0,Monolingual English,1053.2707104046622
live stream hdkawasaki frontale vs johor darul livemelbourne city fc vs jeonnam dragons livelive,40.0,44087.45407038493,28817.10669839047,0.6536350829509097,0,0,0,0.0,6,4,4,Mesolect (Strong Mixing),-15270.347371994456
which part of me are you so interested in i guess not lee the police officer is it lee the suspect,9.523809523809524,13119.387056407795,31743.479251138422,2.419585542728097,0,0,0,0.0,19,2,0,Monolingual English,18624.092194730627
at uptown jalan reko in kajang selangor,40.0,38993.755972815845,26601.864350933647,0.6822083096965295,0,0,0,0.0,2,3,2,Mesolect (Strong Mixing),-12391.891621882198
why are these people begging for a followback,0.0,9405.11540422051,29448.474367629806,3.131112495909929,0,0,0,0.0,8,0,0,Monolingual English,20043.358963409293
been so busy today i been able to drop as many tags as i wanted to but trust me i kept my playlist ru,0.0,16945.964028857772,43710.9899932955,2.5794336585902573,0,0,0,0.0,24,0,0,Monolingual English,26765.02596443773
and i am still awaiting for my mee goreng mamak dear my little brother please at least leave me some takuk so that,9.090909090909093,12669.350866266299,24783.34289539331,1.9561651703389162,0,0,0,0.0,20,2,1,Weak Code-Mixing,12113.992029127012
emang gak salah lagi sik,40.0,46486.44422995849,39017.429454204976,0.8393291872614327,0,0,0,0.0,2,3,0,Mesolect (Strong Mixing),-7469.014775753516
whitelist giveaway for retweet follow me for a chance to winthey are building a l,0.0,15542.55812531435,28997.99912055885,1.8657159836082235,0,0,0,0.0,13,0,2,Monolingual English,13455.440995244498
tingal hari je lagi nak raya oi doubletree by hilton,37.5,44746.73018388851,30258.355793643586,0.6762137852150457,0,0,0,0.0,3,5,2,Mesolect (Strong Mixing),-14488.374390244924
drop your eth addressrt followmint is now live,0.0,31593.583766071617,36329.051525483585,1.149887008529162,0,0,0,0.0,5,0,3,Monolingual English,4735.467759411968
back to album versions with photocards per version,0.0,29761.2499925397,35936.57976600697,1.20749564534471,0,0,0,0.0,8,0,0,Monolingual English,6175.329773467274
wkwkw andra kekuatan lo cuma ngancem gitu doang hahah,50.0,41857.471712938175,43288.094528311995,1.0341784335467068,0,0,0,0.0,3,3,3,Mesolect (Strong Mixing),1430.6228153738193
drag drop look what i just made buddha,12.5,17447.722974500273,43987.716594985715,2.521115027976628,0,0,0,0.0,7,1,0,Monolingual English,26539.993620485442
sehat shin need gws pills kah,40.0,46021.97085316327,30473.41597939732,0.6621493042230885,0,0,0,0.0,2,3,1,Mesolect (Strong Mixing),-15548.554873765952
ibarat kek lapar tapi ga bisa makan gituka,28.57142857142857,45127.985005079885,47159.73445689549,1.0450219404120724,0,0,0,0.0,2,5,1,Mesolect (Strong Mixing),2031.7494518156018
i love the nine of us together i am who i am because of twice,0.0,8348.250307476577,17679.52593212374,2.117752257175399,0,0,0,0.0,14,0,1,Monolingual English,9331.275624647162
raya promo i nak clear kan stock azelaic acid i dgn good molecules brightening toner ni jom bagi kulit muka korang,35.29411764705882,43699.34261242397,36026.54496029298,0.8244184650514726,1,1,0,0.16666666666666666,11,6,4,Mesolect (Strong Mixing),-7672.79765213099
serene siren as the sexy white villain similar to kathryn lod,19.999999999999996,32085.1824982674,45916.57102092486,1.4310833676387644,0,0,0,0.0,8,2,1,Weak Code-Mixing,13831.388522657457
a years old woman came for check up what do you think what would u like to do,0.0,10427.872052155099,26528.766689457985,2.5440249512819215,0,0,0,0.0,18,0,0,Monolingual English,16100.894637302887
sidelined goblins making fun of bulls,0.0,31522.80114808272,62613.367546800706,1.986288187165403,0,0,0,0.0,5,0,1,Monolingual English,31090.566398717987
in this poem brodsky sends multiple messages to ukrainians called with slur khokhly he tells ukrainians to go fu,0.0,24298.841197586924,38088.53710386039,1.5675042605588492,0,0,0,0.0,14,0,5,Monolingual English,13789.695906273468
spoilers we have now gone three episodes of moon knight without steven grant saying,15.384615384615385,28063.269813301966,45377.12890024368,1.6169580096021086,0,1,0,0.10714285714285714,11,2,1,Basilect (Manglish),17313.859086941717
win instant prizes such as vouchers shopee coins and golden tickets,18.181818181818176,41059.86147475703,47359.97620715309,1.1534373109434204,0,0,0,0.0,9,2,0,Weak Code-Mixing,6300.114732396061
if you compare pti jalsa with tlp then one of the biggest jalsa at was organised by allama k,6.666666666666665,13464.962632408533,19860.160917290475,1.4749510607247789,0,1,0,0.07894736842105263,14,1,4,Weak Code-Mixing,6395.1982848819425
di pondok pesanteen riyadlul jannah kak perbatasan malang batu,28.57142857142857,44861.83284742285,19361.417590483976,0.43157883576297573,0,0,0,0.0,2,5,2,Mesolect (Strong Mixing),-25500.41525693887
dalai lama himself would fuck him up in this situation,19.999999999999996,17572.910652936316,37553.81613098121,2.1370287980555016,0,0,0,0.0,8,2,0,Monolingual English,19980.905478044897
aku diem aja jadi batu,40.0,41415.03816880352,9756.457139878763,0.23557764452884064,0,0,0,0.0,3,2,0,Monolingual Malay,-31658.581028924757
kronologi guru ngaji dipukuli batu bata disiksa semalaman dipaksa ngaku jadi begal oleh polisi please ini harus kita,29.411764705882348,43756.05790643198,36370.56454499626,0.8312120946263287,0,0,0,0.0,5,12,1,Mesolect (Strong Mixing),-7385.493361435721
quote aku baca semua buat aku berada di fasa aku xtahu,45.45454545454546,41970.21447068934,10167.302996200608,0.242250441757955,0,0,0,0.0,5,6,0,Monolingual Malay,-31802.91147448873
like father like son,0.0,30159.805587735023,47974.4526148689,1.5906751280379106,0,0,0,0.0,4,0,0,Monolingual English,17814.647027133873
sebelum meniaga kakmaida bekerja as procurement specialist sourcing executive dan purchasing executive di company,50.0,44158.64870829693,37037.82517642725,0.8387445327209083,0,0,0,0.0,5,5,4,Mesolect (Strong Mixing),-7120.8235318696825
fashion slows down at fashion revolution week prestige online malaysia,0.0,42073.95953730199,33024.49975854906,0.7849154232624611,0,0,0,0.0,9,0,1,Monolingual English,-9049.459778752935
win instant prizes such as vouchers shopee coins and golden tickets,18.181818181818176,41059.86147475703,47359.97620715309,1.1534373109434204,0,0,0,0.0,9,2,0,Weak Code-Mixing,6300.114732396061
huawei launches smart office devices in malaysia pixlab matepad wifi mesh,0.0,42448.34828432508,46177.885027834884,1.0878605857294807,0,0,0,0.0,8,0,3,Monolingual English,3729.5367435098015
just posted a photo ttdi jaya shah alam,42.85714285714286,14954.445948593924,19262.283799571076,1.2880640222837672,0,0,0,0.0,4,3,1,Mesolect (Strong Mixing),4307.837850977152
full episod pembuatan roti canai yang sebenar original dari pulau pinang via,41.666666666666664,44343.881429631125,17464.97417031136,0.39385307752155974,0,0,0,0.0,5,7,0,Monolingual Malay,-26878.907259319763
live stream hdkawasaki frontale vs johor darul livemelbourne city fc vs jeonnam dragons livelive,40.0,44087.45407038493,28817.10669839047,0.6536350829509097,0,0,0,0.0,6,4,4,Mesolect (Strong Mixing),-15270.347371994456
sik paling kecroh lama po mas njenengan hehe,33.333333333333336,41784.715693924016,32455.50103246344,0.7767314074888595,0,0,0,0.0,4,2,2,Mesolect (Strong Mixing),-9329.214661460577
tiket bas to let go klang sentral penang sentral friday boleh nego hmu pls beli,46.666666666666664,30246.78365331617,38115.866493695044,1.2601626318544494,0,0,0,0.0,7,8,0,Mesolect (Strong Mixing),7869.082840378873
are here in singapore thanks to my fellow here,0.0,9557.565221201525,22017.45289663619,2.30366755413763,0,0,0,0.0,9,0,0,Monolingual English,12459.887675434666
whitelist spots giveaway to enter follow like rt tag your friends,0.0,35401.45523722116,52574.41754988064,1.4850919883825509,0,0,0,0.0,10,0,1,Monolingual English,17172.96231265948
this is so hot wtf,0.0,5146.253215283705,13113.222977689375,2.548110718443625,0,0,0,0.0,5,0,0,Monolingual English,7966.96976240567
win instant prizes such as vouchers shopee coins and golden tickets,18.181818181818176,41059.86147475703,47359.97620715309,1.1534373109434204,0,0,0,0.0,9,2,0,Weak Code-Mixing,6300.114732396061
am i buggin or did this pink shit used to busss,0.0,24180.77451820015,48031.47151226289,1.9863495884348548,0,0,0,0.0,9,0,2,Monolingual English,23850.696994062742
airdrop event duration april th april th total reward runie tokens airdrop link,30.000000000000004,44190.339261480636,52766.667751259345,1.1940770003830776,0,0,0,0.0,7,3,3,Mesolect (Strong Mixing),8576.328489778709
live stream hdkawasaki frontale vs johor darul livemelbourne city fc vs jeonnam dragons livelive,40.0,44087.45407038493,28817.10669839047,0.6536350829509097,0,0,0,0.0,6,4,4,Mesolect (Strong Mixing),-15270.347371994456
live stream hdkawasaki frontale vs johor darul livemelbourne city fc vs jeonnam dragons livelive,40.0,44087.45407038493,28817.10669839047,0.6536350829509097,0,0,0,0.0,6,4,4,Mesolect (Strong Mixing),-15270.347371994456
happy birthday to james mcavoy,25.0,19746.362629079966,27750.156575342524,1.405330039592992,0,0,0,0.0,3,1,1,Mesolect (Strong Mixing),8003.793946262558
live stream hdkawasaki frontale vs johor darul livemelbourne city fc vs jeonnam dragons livelive,40.0,44087.45407038493,28817.10669839047,0.6536350829509097,0,0,0,0.0,6,4,4,Mesolect (Strong Mixing),-15270.347371994456
gun itu siapa newoff keluar pergi sana op terakhir kali aku kasih tau off kalo aku dapet lenti card offnew,43.75,43653.39580183238,40959.639801492915,0.9382921774844742,0,0,0,0.0,7,9,4,Mesolect (Strong Mixing),-2693.7560003394683
sementara iki isih sementara sik,0.0,46486.079884723156,18289.246636396674,0.39343490958477484,0,0,0,0.0,0,4,1,Monolingual Malay,-28196.833248326482
horny military guys are my favorite,0.0,20321.45958015993,56657.83265481303,2.7880788991224184,0,0,0,0.0,6,0,0,Monolingual English,36336.37307465309
live stream hdkawasaki frontale vs johor darul livemelbourne city fc vs jeonnam dragons livelive,40.0,44087.45407038493,28817.10669839047,0.6536350829509097,0,0,0,0.0,6,4,4,Mesolect (Strong Mixing),-15270.347371994456
kak barang kali masih belum dapet aku open sharingan nihh,33.333333333333336,44650.96057528966,23326.592501879673,0.5224208438370948,0,0,0,0.0,3,6,1,Mesolect (Strong Mixing),-21324.368073409987
cant stop thinking about this,0.0,9066.58512411758,34630.47028092059,3.8195715152777607,0,0,0,0.0,5,0,0,Monolingual English,25563.88515680301
live stream hdkawasaki frontale vs johor darul livemelbourne city fc vs jeonnam dragons livelive,40.0,44087.45407038493,28817.10669839047,0.6536350829509097,0,0,0,0.0,6,4,4,Mesolect (Strong Mixing),-15270.347371994456
i forgot how to write poems,0.0,6479.664746405195,22930.884803600566,3.5388998815598014,0,0,0,0.0,6,0,0,Monolingual English,16451.220057195373
johor govt to provide free shuttle bus from tomorrow to ease congestion at bangunan sultan iskandar says mb,23.529411764705888,31728.311932737677,30808.526574057567,0.9710105800576467,0,0,0,0.0,13,4,1,Mesolect (Strong Mixing),-919.7853586801102
my entry for rider navi level based with megaman battle network falzar gashat,9.999999999999998,35263.77095307059,45827.861703263494,1.2995734847600873,0,0,0,0.0,9,1,3,Weak Code-Mixing,10564.090750192903
photo cardnya kkuma nderada si batu juga ga ya wkwkkw,28.57142857142857,44661.06259713743,56121.06104214467,1.2565993234057482,0,0,0,0.0,5,2,3,Mesolect (Strong Mixing),11459.998445007237
if i stole your heart and you stole mine that be the perfect crime,0.0,14777.012765662585,27192.63519792152,1.8401983966007784,0,0,0,0.0,14,0,0,Monolingual English,12415.622432258937
live stream hdkawasaki frontale vs johor darul livemelbourne city fc vs jeonnam dragons livelive,40.0,44087.45407038493,28817.10669839047,0.6536350829509097,0,0,0,0.0,6,4,4,Mesolect (Strong Mixing),-15270.347371994456
node are now live on chain in we trust,0.0,24426.67842809476,45860.832634723614,1.8774895149876782,0,0,0,0.0,8,0,1,Monolingual English,21434.154206628853
gabisa lebaran mau g ngetik ape sik,40.0,45465.96972444498,48212.147803807864,1.06040073699091,0,0,0,0.0,2,3,2,Mesolect (Strong Mixing),2746.178079362886
there must be deobis who are asleep,0.0,12409.394138227459,24137.298351694055,1.9450827399654012,0,0,0,0.0,6,0,1,Monolingual English,11727.904213466596
tipes tar jempol gua,33.333333333333336,47321.07036411384,32312.632799493054,0.6828381638636284,0,0,0,0.0,2,1,1,Mesolect (Strong Mixing),-15008.437564620785
live stream hdkawasaki frontale vs johor darul livemelbourne city fc vs jeonnam dragons livelive,40.0,44087.45407038493,28817.10669839047,0.6536350829509097,0,0,0,0.0,6,4,4,Mesolect (Strong Mixing),-15270.347371994456
gm go after it today like adora goes after gardenhoses,0.0,29959.4940879941,59405.4391031494,1.9828585532409042,0,0,0,0.0,7,0,3,Monolingual English,29445.945015155303
kalo itu pet card beneran foto binatang peliharaan mereka ya gimana ini cowokku peliharanya batu,41.666666666666664,43976.395057756294,35295.55160474717,0.8026022041686646,0,0,0,0.0,5,7,3,Mesolect (Strong Mixing),-8680.843453009125
from the archives footprints which were left nearly a million years ago by a small group of hominins walking along,5.555555555555558,15263.226271309535,29364.523920680935,1.9238739830436618,0,0,0,0.0,17,1,2,Weak Code-Mixing,14101.2976493714
selangor journal macc views seriously alleged misconduct involving its officer,33.333333333333336,44676.573353991516,40166.96160338317,0.8990609303252339,0,0,0,0.0,6,3,1,Mesolect (Strong Mixing),-4509.6117506083465
i got a lucky price,0.0,6265.236858747119,20370.26852473218,3.2513165877029095,0,0,0,0.0,5,0,0,Monolingual English,14105.03166598506
pioneers by exclusively for johor darul fc lyrics music the full video on,27.27272727272727,35413.7386332933,37093.73576486333,1.0474391351042114,0,1,0,0.11538461538461539,8,3,2,Mesolect (Strong Mixing),1679.9971315700313
jadilah seperti pohon ysng lebat buahnya yg tumbuh ditepi jalan yang dilempari orang dengan batu tapi dibalasnya dengan buah,16.666666666666664,43679.588606831814,31290.018032449265,0.7163533135372816,0,0,0,0.0,3,15,1,Weak Code-Mixing,-12389.57057438255
found an old aigis drawing that i thought was pretty cool but needed some work the result of that,0.0,16086.07615102727,36670.52794743379,2.2796440600644536,0,0,0,0.0,18,0,1,Monolingual English,20584.451796406516
yaa makanya kondisi sdm sepakbola kita jauh banget mereka kema,42.85714285714286,44644.4765798893,47964.73618393088,1.0743711172892827,0,0,0,0.0,3,4,3,Mesolect (Strong Mixing),3320.259604041581
live stream hdkawasaki frontale vs johor darul livemelbourne city fc vs jeonnam dragons livelive,40.0,44087.45407038493,28817.10669839047,0.6536350829509097,0,0,0,0.0,6,4,4,Mesolect (Strong Mixing),-15270.347371994456
wkwkw lu yg kepala batu demi cinta buta sama siwon hilang rasa kemanusiaan terus cari pembenaran mb,25.0,43810.997153891745,37360.663681319216,0.8527690787334763,0,0,0,0.0,4,12,1,Mesolect (Strong Mixing),-6450.333472572529
monsta x mini album shape of photovibe ver pm kst,12.5,45224.40583741363,59805.09965358729,1.3224076368983764,0,0,0,0.0,7,1,2,Weak Code-Mixing,14580.693816173662
fix hatinya udah beku kek es batu,42.85714285714286,45465.969771559416,38750.689366986226,0.8523009530355639,0,0,0,0.0,3,4,0,Mesolect (Strong Mixing),-6715.28040457319
live stream hdkawasaki frontale vs johor darul livemelbourne city fc vs jeonnam dragons livelive,40.0,44087.45407038493,28817.10669839047,0.6536350829509097,0,0,0,0.0,6,4,4,Mesolect (Strong Mixing),-15270.347371994456
ben simmons plans to make his nets debut on monday in game vs boston per,0.0,22157.37330584274,37976.445518522676,1.7139416750499286,0,0,0,0.0,13,0,2,Monolingual English,15819.072212679937
just nak cakap birthday i nanti kalau nak bagi present just transfer je la ye num acc boleh pm hahahahahaahah aca,30.000000000000004,38687.841970248825,15536.342480503456,0.4015820394544362,1,0,0,0.09523809523809523,14,6,1,Mesolect (Strong Mixing),-23151.49948974537
hazwan bakri la siakkk hahahaha,40.0,41427.85136288203,23995.66572518478,0.5792157916904205,1,0,0,0.4,2,3,0,Mesolect (Strong Mixing),-17432.18563769725
ada yg nyempil tapi bukan upil melainkan jempol wkwk,14.28571428571429,44860.98903763542,13759.791879184264,0.30672065360932416,0,0,0,0.0,1,6,2,Monolingual Malay,-31101.19715845116
vogue bunch of hell raiser,0.0,32988.67084110306,57135.229600048966,1.731965191178903,0,0,0,0.0,3,0,2,Monolingual English,24146.558758945903
dekat sb kangar xde pun,19.999999999999996,46486.26205698387,12736.215995644738,0.27397806216452525,0,0,0,0.0,1,4,0,Monolingual Malay,-33750.04606133913
live stream hdkawasaki frontale vs johor darul livemelbourne city fc vs jeonnam dragons livelive,40.0,44087.45407038493,28817.10669839047,0.6536350829509097,0,0,0,0.0,6,4,4,Mesolect (Strong Mixing),-15270.347371994456
sharing k hari k hari k hari k minggu k bulan k bulan,46.15384615384615,44192.78836482137,26607.01993674198,0.602067009601093,0,0,0,0.0,7,6,0,Mesolect (Strong Mixing),-17585.768428079387
framed artwork for sale low tide at malibu pier,33.333333333333336,42315.0419963709,52200.52060269088,1.2336161832751529,0,0,0,0.0,4,2,3,Mesolect (Strong Mixing),9885.478606319979
live stream hdkawasaki frontale vs johor darul livemelbourne city fc vs jeonnam dragons livelive,40.0,44087.45407038493,28817.10669839047,0.6536350829509097,0,0,0,0.0,6,4,4,Mesolect (Strong Mixing),-15270.347371994456
siot lu like semua tweets semalam eh,42.85714285714286,45620.07193899433,39678.0205150957,0.8697491877732093,0,0,0,0.0,4,3,0,Mesolect (Strong Mixing),-5942.051423898636
spyfamily episode preview shots,0.0,47324.63062725326,66132.54094986497,1.397423288324212,0,0,0,0.0,3,0,1,Monolingual English,18807.910322611708
always a sign of spring when the school spring sports are getting going does your school group or team need custo,9.999999999999998,28410.486198707506,46872.47058294928,1.6498299344515153,0,0,0,0.0,18,2,1,Weak Code-Mixing,18461.984384241776
announcement with is upcoming soon on the original series grammy global spin the per,0.0,25228.89359080697,42062.05217640659,1.667217471309696,0,0,0,0.0,13,0,1,Monolingual English,16833.158585599624
live stream hdkawasaki frontale vs johor darul livemelbourne city fc vs jeonnam dragons livelive,40.0,44087.45407038493,28817.10669839047,0.6536350829509097,0,0,0,0.0,6,4,4,Mesolect (Strong Mixing),-15270.347371994456
my first drop the origin the origin of life is one of the great outstanding mysteries of science paul davies,5.263157894736848,12207.148142667513,26245.356116402072,2.1499989849936334,0,1,0,0.075,18,1,1,Monolingual English,14038.20797373456
live stream hdkawasaki frontale vs johor darul livemelbourne city fc vs jeonnam dragons livelive,40.0,44087.45407038493,28817.10669839047,0.6536350829509097,0,0,0,0.0,6,4,4,Mesolect (Strong Mixing),-15270.347371994456
lanang kok lemah eman sek enom,0.0,45899.00227247369,62511.25499621681,1.3619305845718945,0,0,0,0.0,0,4,2,Ambiguous,16612.25272374312
my kid comes home from daycare like she just worked a,0.0,24908.259353266636,35206.427974703074,1.4134439293962895,0,0,0,0.0,10,0,1,Monolingual English,10298.168621436438
the reunion old bontang kalimantan timur indonesia,50.0,32285.903463370945,21620.577153509334,0.6696599702727336,0,1,0,0.21428571428571427,3,3,1,Mesolect (Strong Mixing),-10665.326309861612
lets talk independence this sunday april at pm come long to kirkcaldy to hear an inspiring vis,12.5,32309.413966786033,40188.66038553263,1.2438684411560803,0,0,0,0.0,14,2,1,Weak Code-Mixing,7879.246418746599
happy th birthday to our patron her majesty the queen from all in dartford guiding,7.692307692307687,22116.60515252407,38828.45759457171,1.7556246687408257,0,0,0,0.0,12,1,2,Weak Code-Mixing,16711.85244204764
peh hazwan bakri masuk doh,0.0,46486.079884723156,45467.60918318213,0.9780908456022396,0,0,0,0.0,0,5,0,Ambiguous,-1018.470701541024
live stream hdkawasaki frontale vs johor darul livemelbourne city fc vs jeonnam dragons livelive,40.0,44087.45407038493,28817.10669839047,0.6536350829509097,0,0,0,0.0,6,4,4,Mesolect (Strong Mixing),-15270.347371994456
siapa yg kau tag gblg,50.0,46487.71934084444,9338.146146870371,0.20087339794847303,0,0,0,0.0,2,2,1,Monolingual Malay,-37149.573193974065
desire band metal kelantan boleh dikatakan band metal pertama dari kelantan dan gergasi metal malaysia suatu ketika dahulu,50.0,43741.81285307023,20340.020325180416,0.46500176829668716,0,0,0,0.0,9,9,0,Mesolect (Strong Mixing),-23401.792527889815
i have feeling too,0.0,4485.780681557866,7674.127099848679,1.7107673434412163,0,0,0,0.0,4,0,0,Monolingual English,3188.346418290813
aku mau semuanyaa termasuk si batu,40.0,41572.65035129155,11729.03645487282,0.28213347851921183,0,0,0,0.0,2,3,1,Monolingual Malay,-29843.613896418734
me going out to eat when i visit my mom after moving to the big city,0.0,10385.538247247541,26101.191726013178,2.513224746240834,0,0,0,0.0,16,0,0,Monolingual English,15715.653478765636
program sumbangan ihya ramadan kapar tahniah diucapkan kepada lujnah kebajikan dan kemasyarakatan dewan muslimat,15.384615384615385,44070.754185806356,35066.52789140128,0.7956870387004854,0,0,0,0.0,2,11,1,Weak Code-Mixing,-9004.226294405074
live stream hdkawasaki frontale vs johor darul livemelbourne city fc vs jeonnam dragons livelive,40.0,44087.45407038493,28817.10669839047,0.6536350829509097,0,0,0,0.0,6,4,4,Mesolect (Strong Mixing),-15270.347371994456
yg fitnah tu salah muka lawyer je yg duk posing ni loyer buruk aka civil lawyer yg keluar kenyat,47.05882352941176,42194.924260976426,22404.453681085135,0.530975089385471,0,0,0,0.0,9,8,2,Mesolect (Strong Mixing),-19790.47057989129
gentle reminder that isko moreno also privatized the divisoria without consulting current tenants,12.5,41809.590448584386,55554.15413787293,1.3287418877300654,0,0,0,0.0,7,1,5,Weak Code-Mixing,13744.563689288545
thoughts on these home away and third shirt concepts from rate each out of,0.0,20379.64383245866,44762.733005843016,2.1964433418875267,0,0,0,0.0,14,0,0,Monolingual English,24383.089173384356
look daddy no hands,0.0,38237.44974525464,53155.9220121955,1.390153432468186,0,0,0,0.0,4,0,0,Monolingual English,14918.472266940858
they just pick and choose,0.0,20499.455600449648,43724.93512903638,2.132980308417424,0,0,0,0.0,5,0,0,Monolingual English,23225.47952858673
aside from it honestly ive met some great friends whom i love to chat with,6.666666666666665,18186.05723536779,37515.969170400414,2.06289734409503,0,1,0,0.1,14,1,0,Monolingual English,19329.911935032625
debut acl hazwan bakri,25.0,47321.51540066551,36709.60803927519,0.7757487842149476,0,0,0,0.0,1,3,0,Mesolect (Strong Mixing),-10611.907361390317
were giving al spots and for our insane poster drop hoursto enter rt tag friend,0.0,30505.451678079575,43502.53571344279,1.42605774772719,0,0,0,0.0,14,0,1,Monolingual English,12997.084035363216
malaysian public transport is shit lah admit it it has nothing to do with malas jalan or what i used to wake up a,12.5,11732.779705326144,26841.028306352324,2.287695582843657,0,0,0,0.0,21,3,0,Monolingual English,15108.24860102618
this country is a joke,0.0,2163.14466345206,7596.119602102162,3.5116096165199955,0,0,0,0.0,5,0,0,Monolingual English,5432.974938650103
uish tekaan meleset hazwan bakri yg masuk unexpected betul haha,30.000000000000004,36566.57397326244,28974.02328728815,0.7923636299226178,0,0,0,0.0,3,7,0,Mesolect (Strong Mixing),-7592.550685974293
your wife referring to kate now still makes me giddy like i was the one who got married,0.0,13341.800501780255,35316.86440639606,2.6470838326269064,0,1,0,0.08333333333333333,18,0,0,Monolingual English,21975.063904615803
pengen ah ah tapi disuruh diem sama si abang kuli promo flash slot jilid only rp harga normal rp,38.888888888888886,43710.65307881524,51617.229641154234,1.1808844298913252,1,0,0,0.10526315789473684,11,7,1,Mesolect (Strong Mixing),7906.576562338996
based ivar v s cringe amleth spicy bets on ivar every time,0.0,28046.119863270713,42303.764266562495,1.5083642397878945,0,0,0,0.0,9,0,3,Monolingual English,14257.644403291783
the weed has hit my system,0.0,19890.043241239873,22181.760347823907,1.115219312436305,0,0,0,0.0,6,0,0,Monolingual English,2291.717106584034
tahniah yayasan amal cawangan selangor,0.0,46486.079884723156,11746.666948814636,0.2526921387637802,0,0,0,0.0,0,5,0,Monolingual Malay,-34739.41293590852
wl giveaway im giving away one d wl spot how enter follow,16.666666666666664,42162.1681565069,51041.3036413354,1.2105948501478612,0,1,0,0.125,10,2,0,Basilect (Manglish),8879.135484828497
ye do aku rasa girls yang menggelitis ni either tak pernah confess direject or simply too insecur,21.42857142857143,42307.18757900181,26958.40167296687,0.6372061868358994,0,0,0,0.0,11,3,3,Mesolect (Strong Mixing),-15348.78590603494
not alexis going back to colby after he already rejected her once only to be pissed when she gets rejected again,0.0,16316.91645818379,30037.42772225702,1.8408764792805978,0,1,0,0.07142857142857142,19,0,2,Monolingual English,13720.51126407323
aku yg kerja courier lain pun beli brg kt shopee dptnyaa j t hmm kena selfcollectlah jawabnyaa,35.71428571428571,42164.61220978972,22757.913468460032,0.5397396602446668,0,0,0,0.0,5,9,3,Mesolect (Strong Mixing),-19406.698741329685
salman khan has got the most loyal fans across the globe he has pure raw stardom if the story of lives up to the e,4.1666666666666625,11477.889196254408,24917.17141660584,2.1708844710521418,0,0,0,0.0,23,1,1,Monolingual English,13439.282220351433
